[
  {
    "id": "TREE-0001",
    "variety": "Unknown",
    "position": {
      "lat": 0.0,
      "lng": 0.0,
      "pixel_x": 22,
      "pixel_y": 0
    },
    "canopy_radius_m": 5.039011001586914,
    "health_index": 1.0,
    "grid_row": 0,
    "grid_col": 3,
    "notes": []
  },
  {
    "id": "TREE-0002",
    "variety": "Unknown",
    "position": {
      "lat": 0.0,
      "lng": 0.0,
      "pixel_x": 105,
      "pixel_y": 0
    },
    "canopy_radius_m": 4.609872341156006,
    "health_index": 1.0,
    "grid_row": 0,
    "grid_col": 14,
    "notes": []
  },
  {
    "id": "TREE-0003",
    "variety": "Unknown",
    "position": {
      "lat": 0.0,
      "lng": 0.0,
      "pixel_x": 112,
      "pixel_y": 0
    },
    "canopy_radius_m": 4.609872341156006,
    "health_index": 1.0,
    "grid_row": 0,
    "grid_col": 15,
    "notes": []
  },
  {
    "id": "TREE-0004",
    "variety": "Unknown",
    "position": {
      "lat": 0.0,
      "lng": 0.0,
      "pixel_x": 817,
      "pixel_y": 0
    },
    "canopy_radius_m": 7.648629188537598,
    "health_index": 1.0,
    "grid_row": 0,
    "grid_col": 109,
    "notes": []
  },
  {
    "id": "TREE-0005",
    "variety": "Unknown",
    "position": {
      "lat": 0.0,
      "lng": 0.0,
      "pixel_x": 825,
      "pixel_y": 0
    },
    "canopy_radius_m": 7.648629188537598,
    "health_index": 1.0,
    "grid_row": 0,
    "grid_col": 110,
    "notes": []
  },
  {
    "id": "TREE-0006",
    "variety": "Unknown",
    "position": {
      "lat": 0.0,
      "lng": 0.0,
      "pixel_x": 907,
      "pixel_y": 0
    },
    "canopy_radius_m": 9.552586555480957,
    "health_index": 1.0,
    "grid_row": 0,
    "grid_col": 121,
    "notes": []
  },
  {
    "id": "TREE-0007",
    "variety": "Unknown",
    "position": {
      "lat": 0.0,
      "lng": 0.0,
      "pixel_x": 915,
      "pixel_y": 0
    },
    "canopy_radius_m": 9.552586555480957,
    "health_index": 1.0,
    "grid_row": 0,
    "grid_col": 122,
    "notes": []
  },
  {
    "id": "TREE-0008",
    "variety": "Unknown",
    "position": {
      "lat": 0.0,
      "lng": 0.0,
      "pixel_x": 22,
      "pixel_y": 7
    },
    "canopy_radius_m": 5.039011001586914,
    "health_index": 1.0,
    "grid_row": 1,
    "grid_col": 3,
    "notes": []
  },
  {
    "id": "TREE-0009",
    "variety": "Unknown",
    "position": {
      "lat": 0.0,
      "lng": 0.0,
      "pixel_x": 142,
      "pixel_y": 7
    },
    "canopy_radius_m": 8.329618453979492,
    "health_index": 1.0,
    "grid_row": 1,
    "grid_col": 19,
    "notes": []
  },
  {
    "id": "TREE-0010",
    "variety": "Unknown",
    "position": {
      "lat": 0.0,
      "lng": 0.0,
      "pixel_x": 210,
      "pixel_y": 7
    },
    "canopy_radius_m": 13.514707565307617,
    "health_index": 1.0,
    "grid_row": 1,
    "grid_col": 28,
    "notes": []
  },
  {
    "id": "TREE-0011",
    "variety": "Unknown",
    "position": {
      "lat": 0.0,
      "lng": 0.0,
      "pixel_x": 307,
      "pixel_y": 7
    },
    "canopy_radius_m": 9.013978004455566,
    "health_index": 1.0,
    "grid_row": 1,
    "grid_col": 41,
    "notes": []
  },
  {
    "id": "TREE-0012",
    "variety": "Unknown",
    "position": {
      "lat": 0.0,
      "lng": 0.0,
      "pixel_x": 517,
      "pixel_y": 7
    },
    "canopy_radius_m": 25.045059204101562,
    "health_index": 1.0,
    "grid_row": 1,
    "grid_col": 69,
    "notes": []
  },
  {
    "id": "TREE-0013",
    "variety": "Unknown",
    "position": {
      "lat": 0.0,
      "lng": 0.0,
      "pixel_x": 585,
      "pixel_y": 7
    },
    "canopy_radius_m": 8.62434196472168,
    "health_index": 1.0,
    "grid_row": 1,
    "grid_col": 78,
    "notes": []
  },
  {
    "id": "TREE-0014",
    "variety": "Unknown",
    "position": {
      "lat": 0.0,
      "lng": 0.0,
      "pixel_x": 592,
      "pixel_y": 7
    },
    "canopy_radius_m": 8.62434196472168,
    "health_index": 1.0,
    "grid_row": 1,
    "grid_col": 79,
    "notes": []
  },
  {
    "id": "TREE-0015",
    "variety": "Unknown",
    "position": {
      "lat": 0.0,
      "lng": 0.0,
      "pixel_x": 1132,
      "pixel_y": 7
    },
    "canopy_radius_m": 30.432689666748047,
    "health_index": 1.0,
    "grid_row": 1,
    "grid_col": 151,
    "notes": []
  },
  {
    "id": "TREE-0016",
    "variety": "Unknown",
    "position": {
      "lat": 0.0,
      "lng": 0.0,
      "pixel_x": 135,
      "pixel_y": 15
    },
    "canopy_radius_m": 8.329618453979492,
    "health_index": 1.0,
    "grid_row": 2,
    "grid_col": 18,
    "notes": []
  },
  {
    "id": "TREE-0017",
    "variety": "Unknown",
    "position": {
      "lat": 0.0,
      "lng": 0.0,
      "pixel_x": 142,
      "pixel_y": 15
    },
    "canopy_radius_m": 8.329618453979492,
    "health_index": 1.0,
    "grid_row": 2,
    "grid_col": 19,
    "notes": []
  },
  {
    "id": "TREE-0018",
    "variety": "Unknown",
    "position": {
      "lat": 0.0,
      "lng": 0.0,
      "pixel_x": 427,
      "pixel_y": 15
    },
    "canopy_radius_m": 4.242740631103516,
    "health_index": 1.0,
    "grid_row": 2,
    "grid_col": 57,
    "notes": []
  },
  {
    "id": "TREE-0019",
    "variety": "Unknown",
    "position": {
      "lat": 0.0,
      "lng": 0.0,
      "pixel_x": 517,
      "pixel_y": 15
    },
    "canopy_radius_m": 25.045059204101562,
    "health_index": 1.0,
    "grid_row": 2,
    "grid_col": 69,
    "notes": []
  },
  {
    "id": "TREE-0020",
    "variety": "Unknown",
    "position": {
      "lat": 0.0,
      "lng": 0.0,
      "pixel_x": 157,
      "pixel_y": 22
    },
    "canopy_radius_m": 6.946321964263916,
    "health_index": 1.0,
    "grid_row": 3,
    "grid_col": 21,
    "notes": []
  },
  {
    "id": "TREE-0021",
    "variety": "Unknown",
    "position": {
      "lat": 0.0,
      "lng": 0.0,
      "pixel_x": 165,
      "pixel_y": 22
    },
    "canopy_radius_m": 6.946321964263916,
    "health_index": 1.0,
    "grid_row": 3,
    "grid_col": 22,
    "notes": []
  },
  {
    "id": "TREE-0022",
    "variety": "Unknown",
    "position": {
      "lat": 0.0,
      "lng": 0.0,
      "pixel_x": 427,
      "pixel_y": 22
    },
    "canopy_radius_m": 4.242740631103516,
    "health_index": 1.0,
    "grid_row": 3,
    "grid_col": 57,
    "notes": []
  },
  {
    "id": "TREE-0023",
    "variety": "Unknown",
    "position": {
      "lat": 0.0,
      "lng": 0.0,
      "pixel_x": 622,
      "pixel_y": 22
    },
    "canopy_radius_m": 29.11154556274414,
    "health_index": 1.0,
    "grid_row": 3,
    "grid_col": 83,
    "notes": []
  },
  {
    "id": "TREE-0024",
    "variety": "Unknown",
    "position": {
      "lat": 0.0,
      "lng": 0.0,
      "pixel_x": 630,
      "pixel_y": 22
    },
    "canopy_radius_m": 29.11154556274414,
    "health_index": 1.0,
    "grid_row": 3,
    "grid_col": 84,
    "notes": []
  },
  {
    "id": "TREE-0025",
    "variety": "Unknown",
    "position": {
      "lat": 0.0,
      "lng": 0.0,
      "pixel_x": 67,
      "pixel_y": 30
    },
    "canopy_radius_m": 7.211202621459961,
    "health_index": 1.0,
    "grid_row": 4,
    "grid_col": 9,
    "notes": []
  },
  {
    "id": "TREE-0026",
    "variety": "Unknown",
    "position": {
      "lat": 0.0,
      "lng": 0.0,
      "pixel_x": 382,
      "pixel_y": 30
    },
    "canopy_radius_m": 21.639184951782227,
    "health_index": 1.0,
    "grid_row": 4,
    "grid_col": 51,
    "notes": []
  },
  {
    "id": "TREE-0027",
    "variety": "Unknown",
    "position": {
      "lat": 0.0,
      "lng": 0.0,
      "pixel_x": 390,
      "pixel_y": 30
    },
    "canopy_radius_m": 21.639184951782227,
    "health_index": 1.0,
    "grid_row": 4,
    "grid_col": 52,
    "notes": []
  },
  {
    "id": "TREE-0028",
    "variety": "Unknown",
    "position": {
      "lat": 0.0,
      "lng": 0.0,
      "pixel_x": 892,
      "pixel_y": 30
    },
    "canopy_radius_m": 64.34681701660156,
    "health_index": 1.0,
    "grid_row": 4,
    "grid_col": 119,
    "notes": []
  },
  {
    "id": "TREE-0029",
    "variety": "Unknown",
    "position": {
      "lat": 0.0,
      "lng": 0.0,
      "pixel_x": 952,
      "pixel_y": 30
    },
    "canopy_radius_m": 7.835224628448486,
    "health_index": 1.0,
    "grid_row": 4,
    "grid_col": 127,
    "notes": []
  },
  {
    "id": "TREE-0030",
    "variety": "Unknown",
    "position": {
      "lat": 0.0,
      "lng": 0.0,
      "pixel_x": 1200,
      "pixel_y": 30
    },
    "canopy_radius_m": 44.207000732421875,
    "health_index": 1.0,
    "grid_row": 4,
    "grid_col": 160,
    "notes": []
  },
  {
    "id": "TREE-0031",
    "variety": "Unknown",
    "position": {
      "lat": 0.0,
      "lng": 0.0,
      "pixel_x": 1207,
      "pixel_y": 30
    },
    "canopy_radius_m": 44.207000732421875,
    "health_index": 1.0,
    "grid_row": 4,
    "grid_col": 161,
    "notes": []
  },
  {
    "id": "TREE-0032",
    "variety": "Unknown",
    "position": {
      "lat": 0.0,
      "lng": 0.0,
      "pixel_x": 67,
      "pixel_y": 37
    },
    "canopy_radius_m": 7.211202621459961,
    "health_index": 1.0,
    "grid_row": 5,
    "grid_col": 9,
    "notes": []
  },
  {
    "id": "TREE-0033",
    "variety": "Unknown",
    "position": {
      "lat": 0.0,
      "lng": 0.0,
      "pixel_x": 330,
      "pixel_y": 37
    },
    "canopy_radius_m": 10.770429611206055,
    "health_index": 1.0,
    "grid_row": 5,
    "grid_col": 44,
    "notes": []
  },
  {
    "id": "TREE-0034",
    "variety": "Unknown",
    "position": {
      "lat": 0.0,
      "lng": 0.0,
      "pixel_x": 337,
      "pixel_y": 37
    },
    "canopy_radius_m": 10.770429611206055,
    "health_index": 1.0,
    "grid_row": 5,
    "grid_col": 45,
    "notes": []
  },
  {
    "id": "TREE-0035",
    "variety": "Unknown",
    "position": {
      "lat": 0.0,
      "lng": 0.0,
      "pixel_x": 450,
      "pixel_y": 37
    },
    "canopy_radius_m": 3.9052248001098633,
    "health_index": 1.0,
    "grid_row": 5,
    "grid_col": 60,
    "notes": []
  },
  {
    "id": "TREE-0036",
    "variety": "Unknown",
    "position": {
      "lat": 0.0,